{"$id":"implementation-availability-policy-v0.schema.json","$schema":"https://json-schema.org/draft/2020-12/schema","additionalProperties":false,"properties":{"canonical_profile":{"const":"schuss-canonical-json-v1"},"catalog_reference":{"additionalProperties":false,"properties":{"catalog_id":{"pattern":"^schuss-catalog-[0-9]{6}$","type":"string"},"content_hash":{"pattern":"^sha256:[0-9a-f]{64}$","type":"string"},"revision":{"minimum":1,"type":"integer"}},"required":["catalog_id","revision","content_hash"],"type":"object"},"content_hash":{"pattern":"^sha256:[0-9a-f]{64}$","type":"string"},"display_name":{"minLength":1,"type":"string"},"family_union_allowed":{"const":false},"implementation_availability_policy_id":{"pattern":"^schuss-implementation-availability-policy-[0-9]{6}$","type":"string"},"readiness_order":{"items":{"enum":["catalogued-only","contracted","bound","eligible","compile-proven","device-tested","real-time-tested","audible-tested","unresolved"]},"minItems":9,"type":"array","uniqueItems":true,"x-schuss-array-kind":"sequence"},"reported_pairs":{"items":{"additionalProperties":false,"properties":{"backend_reference":{"additionalProperties":false,"properties":{"backend_id":{"pattern":"^schuss-backend-[0-9]{6}$","type":"string"},"content_hash":{"pattern":"^sha256:[0-9a-f]{64}$","type":"string"},"revision":{"minimum":1,"type":"integer"}},"required":["backend_id","revision","content_hash"],"type":"object"},"display_name":{"minLength":1,"type":"string"},"pair_id":{"pattern":"^availability-pair-[0-9]{6}$","type":"string"},"target_reference":{"additionalProperties":false,"properties":{"compute_target_id":{"pattern":"^schuss-compute-target-[0-9]{6}$","type":"string"},"content_hash":{"pattern":"^sha256:[0-9a-f]{64}$","type":"string"},"revision":{"minimum":1,"type":"integer"}},"required":["compute_target_id","revision","content_hash"],"type":"object"}},"required":["pair_id","display_name","target_reference","backend_reference"],"type":"object"},"minItems":1,"type":"array","uniqueItems":true,"x-schuss-array-kind":"sequence"},"revision":{"minimum":1,"type":"integer"},"schema_version":{"const":"implementation-availability-policy-v0"},"selection_authority":{"const":false},"source_presence_implies_support":{"const":false}},"required":["schema_version","canonical_profile","implementation_availability_policy_id","revision","content_hash","display_name","catalog_reference","reported_pairs","readiness_order","selection_authority","family_union_allowed","source_presence_implies_support"],"title":"Schuss implementation availability policy v0","type":"object"}
