{"canonical_profile":"schuss-canonical-json-v1","catalog_reference":{"catalog_id":"schuss-catalog-000001","content_hash":"sha256:5340646a89f52fe4909e5399d411c92b774f8177c077196f405f95c1f7153542","revision":6},"content_hash":"sha256:6fe2caa14b4c41bc1349c0df32a88f91bbb82621e20b92e100e0995dbf97b25b","display_name":"Desktop Host and current direct-Ksoloti availability","family_union_allowed":false,"implementation_availability_policy_id":"schuss-implementation-availability-policy-000001","readiness_order":["catalogued-only","contracted","bound","eligible","compile-proven","device-tested","real-time-tested","audible-tested","unresolved"],"reported_pairs":[{"backend_reference":{"backend_id":"schuss-backend-000003","content_hash":"sha256:c188a702201625cbf32d49976ce54a06194dea89d3815e972e319f4b6199a116","revision":1},"display_name":"Desktop Host","pair_id":"availability-pair-000001","target_reference":{"compute_target_id":"schuss-compute-target-000002","content_hash":"sha256:8e66c6e40db0215c69c44852f6838a289342f372379262b87acc4a2bb49bd290","revision":1}},{"backend_reference":{"backend_id":"schuss-backend-000002","content_hash":"sha256:e30889d5a33fca838086a0f3f8aacdcd065826d64fea396f74bda8aa164ee9db","revision":4},"display_name":"Ksoloti Core","pair_id":"availability-pair-000002","target_reference":{"compute_target_id":"schuss-compute-target-000001","content_hash":"sha256:d8a9652bd079d0f2a8806cc4922f2a380c8092549f267047d5a4a0360b4a6753","revision":2}}],"revision":1,"schema_version":"implementation-availability-policy-v0","selection_authority":false,"source_presence_implies_support":false}
